{
  "allowedInvalidReasons": [
    "runner-crash-before-result",
    "custody-interruption",
    "integrity-check-failure"
  ],
  "bundleState": "not-created",
  "candidateExecutionState": "not-run",
  "candidateLockRef": {
    "contentHash": "773c2a403a9cbeb418e6c1deb4ff7f6599165f444061e205a7a510376aeb1046",
    "id": "REG-NORM-SHARP@0.4.0",
    "path": "candidate-locks/composite-sharp-win32-x64.v0.4.0.json"
  },
  "capabilityContractRefs": [
    {
      "contentHash": "534ba211e44d1ef669c75cb130c3e1e3cd63dff7be61dd246853dd72d1ebdeca",
      "id": "CC-CAP02-NORMALIZE-PNG@0.4.0",
      "path": "contracts/cc-cap02-normalize-png.v0.4.0.json"
    },
    {
      "contentHash": "8c2fef119a53af39c02108bde6ffd7e8390bebbd77a31d935734033da1c1cd7f",
      "id": "CC-CAP02-EXPORT-PNG@0.4.0",
      "path": "contracts/cc-cap02-export-png.v0.4.0.json"
    }
  ],
  "contentHash": "955f0f345849da6da0d4d2fee9f530547f576ad0210515c510012cb5178d675b",
  "custodyLedgerState": "not-created",
  "evidenceBoundary": {
    "c1": 0,
    "e1": 0,
    "g1": 0,
    "o1": 0,
    "r1Pipeline": 0,
    "r1ProductRelease": 0,
    "r1ProductValidation": 0,
    "releaseAllowlist": "none",
    "releaseApproved": 0,
    "releaseRegistered": 0,
    "u1": 0,
    "v1": 0
  },
  "evidenceManifestState": "not-created",
  "externalPinsState": "not-created",
  "formalDefectHoldoutStatus": "not-created",
  "formalEscapeStatus": "not-created",
  "formalHoldoutStatus": "not-created",
  "formalRunPrerequisites": {
    "actualRunnerState": "not-created",
    "approvalState": "not-approved",
    "durableCrossProcessConsumedRequestLedgerState": "not-created",
    "formalRunBlocked": true,
    "operationSpecificOracleState": "not-created",
    "roleAssignmentState": "not-assigned",
    "trustedAuthorityState": "not-created"
  },
  "formatTargetRef": {
    "contentHash": "cbfce3cfd827082d69b29c3fafbc8f3c9e3a93d03a2dd9216ac0a38a6b0f7159",
    "id": "FT-NORMALIZE-DELIVER@0.4.0",
    "path": "profiles/format-target.normalize-deliver.v0.4.0.json"
  },
  "frozenAt": "2026-08-15T00:20:45.916Z",
  "gateBState": "not-entered",
  "partitionPlanRefs": [
    {
      "contentHash": "35c59353b75fb517c428ea87cf9c50b379cdddb29261e2f30655e7fd761b9700",
      "id": "PP-NORMALIZE-PNG@0.4.0",
      "path": "preregistrations/partition-plan.normalize-png.v0.4.0.json"
    },
    {
      "contentHash": "69f5965e7da9e873831573f84139b0f0cadcee07af99b15b7c7866729897ec09",
      "id": "PP-EXPORT-PNG@0.4.0",
      "path": "preregistrations/partition-plan.export-png.v0.4.0.json"
    }
  ],
  "pixelMaterialState": "none",
  "preregistrationRefs": [
    {
      "contentHash": "95f5e481352dd440e0a47e6b03193f4af4c0ea7656f1505ed3ca63e8aae2f84e",
      "id": "PREREG-NORMALIZE-PNG@0.4.0",
      "path": "preregistrations/preregistration.normalize-png.v0.4.0.json"
    },
    {
      "contentHash": "86e418f7227bdb880c9a4bc44ce7757fc4463d50c226855639bcc8e77941b134",
      "id": "PREREG-EXPORT-PNG@0.4.0",
      "path": "preregistrations/preregistration.export-png.v0.4.0.json"
    }
  ],
  "productSupport": false,
  "qaProfileRef": {
    "contentHash": "14e4c246989dda8907a6b0c118a586c94dd87ea221880d692ec7f7c405272986",
    "id": "QA-NORMALIZE-DELIVER@0.4.0",
    "path": "preregistrations/qa-profile.normalize-deliver.v0.4.0.json"
  },
  "recordVersion": "0.4.0",
  "requestPolicyState": "execution-envelope-reference-only-not-runnable",
  "requestStatus": "not-issued-awaiting-custodian-bundle",
  "schemaVersion": "seal-intent.slice04.v0",
  "sealIntentId": "SEAL-INTENT-NORMALIZE-DELIVER@0.4.0",
  "sealPolicyRef": {
    "compatibilityState": "execution-envelope-reference-only",
    "externalTrustedPinsRequired": [
      "expectedPlanSha256",
      "expectedBundleSha256",
      "expectedCustodianId"
    ],
    "implementationPath": "scripts/research-seal-ceremony-slice03.mjs",
    "implementationSha256": "70c36d1d8eecd4099d11ffb7f04754b7c54bbd6d56c46a35a0d4850f8d8ac58a",
    "requiredMode": "formal",
    "schemaPaths": [
      "research/slice-03/schemas/seal-ceremony-bundle-manifest.v0.schema.json",
      "research/slice-03/schemas/seal-ceremony-custody-event.v0.schema.json",
      "research/slice-03/schemas/seal-ceremony-plan.v0.schema.json",
      "research/slice-03/schemas/seal-ceremony-result-summary.v0.schema.json",
      "research/slice-03/schemas/seal-ceremony-run-receipt.v0.schema.json",
      "research/slice-03/schemas/seal-ceremony-run-request.v0.schema.json"
    ],
    "schemaTreeSha256": "dd4291953ac349d9a19ffe306a279e5efb51243794cdc81733104876fbb34ecb"
  },
  "secretMaterialState": "none",
  "suiteId": "NORMALIZE-DELIVER",
  "suiteVersion": "0.4.0"
}
